{
  "$schema": "https://json-schema.org/draft/2020-12/schema",
  "$id": "urn:dla:contracts:interface-c.v1.schema.json",
  "title": "Interface C v1: settings and corrections (both directions)",
  "description": "One document, used in both directions: the agent sends changes made on the PC, the backend sends changes made on the dashboard. Spec: FR-28 (pause tracking, hide apps/sites, correct labels, delete by date or all), FR-8 (corrections saved as personal rules, applied to past and future), FR-4 (retention 30 days, user-configurable), FR-3 (idle threshold, default 3 minutes), FR-21 (nudge snooze / turn off), 'What We Store' (Rules, daily goal, Account + settings in the cloud). Decision note website-activation.md (terms version and accepted-at). The CONSENT record is NOT in this document: consent stays local and is never synced.",
  "type": "object",
  "additionalProperties": false,
  "required": ["schema_version", "device_id", "revision", "updated_at", "updated_by", "settings", "rules"],
  "properties": {
    "schema_version": { "const": "interface-c.v1" },
    "device_id": { "$ref": "#/$defs/uuid" },
    "revision": {
      "description": "Increases by 1 with every accepted change of this document. A writer must base its change on the latest revision it has seen; on a mismatch the receiver rejects and the writer re-reads and merges. Conflict handling is OQ-C1.",
      "x-open-question": "OQ-C1",
      "type": "integer",
      "minimum": 0
    },
    "updated_at": { "$ref": "#/$defs/utcTimestamp" },
    "updated_by": { "enum": ["agent", "dashboard"] },
    "settings": {
      "type": "object",
      "additionalProperties": false,
      "required": ["retention_days", "idle_threshold_seconds", "paused", "excluded_apps", "excluded_sites", "nudges", "daily_goal"],
      "properties": {
        "retention_days": {
          "description": "How long raw events stay on the PC. Default 30. The 1 to 3650 range is the agent's current choice, not the spec's: OQ-C5.",
          "x-open-question": "OQ-C5",
          "type": "integer",
          "minimum": 1,
          "maximum": 3650
        },
        "idle_threshold_seconds": {
          "description": "No input for this long means away. Default 180. The 30 to 3600 range is the agent's current choice: OQ-C5.",
          "x-open-question": "OQ-C5",
          "type": "integer",
          "minimum": 30,
          "maximum": 3600
        },
        "paused": {
          "description": "Pause tracking (FR-28). DECIDED (OQ-C3): the dashboard may set this to true but may not set it back to false; only the user at the PC can resume. The agent ignores a dashboard value of false while the PC is paused. This rule is behaviour, not something the schema can enforce.",
          "x-decision": "OQ-C3",
          "type": "boolean"
        },
        "excluded_apps": {
          "description": "Executable names the user chose to hide, for example keepass.exe (FR-28). Sending these to the cloud is OQ-C2.",
          "x-open-question": "OQ-C2",
          "type": "array",
          "maxItems": 500,
          "uniqueItems": true,
          "items": { "type": "string", "minLength": 1, "maxLength": 260 }
        },
        "excluded_sites": {
          "description": "Domains the user chose to hide (FR-28), domain only, never a full URL. Sending these to the cloud is OQ-C2.",
          "x-open-question": "OQ-C2",
          "type": "array",
          "maxItems": 500,
          "uniqueItems": true,
          "items": { "type": "string", "minLength": 1, "maxLength": 253, "pattern": "^[A-Za-z0-9.-]+$" }
        },
        "nudges": {
          "description": "FR-21: snoozable and can be turned off. 'Off by default after 2 ignores' is decided by the agent and written here as enabled=false.",
          "type": "object",
          "additionalProperties": false,
          "required": ["enabled", "snoozed_until"],
          "properties": {
            "enabled": { "type": "boolean" },
            "snoozed_until": { "oneOf": [{ "$ref": "#/$defs/utcTimestamp" }, { "type": "null" }] }
          }
        },
        "daily_goal": {
          "description": "The user's goal for the day (FR-12). Where the 'auto-suggested goal from history' is produced is OQ-C7.",
          "x-open-question": "OQ-C7",
          "type": "object",
          "additionalProperties": false,
          "required": ["date", "text"],
          "properties": {
            "date": { "type": "string", "pattern": "^\\d{4}-\\d{2}-\\d{2}$" },
            "text": { "type": ["string", "null"], "maxLength": 280 }
          }
        }
      }
    },
    "rules": {
      "description": "Personal rules from user corrections (FR-8). Deleted rules stay as tombstones (deleted=true) so the deletion also reaches the other side. 'Apply to all similar' means the agent relabels past events locally and re-uploads the affected hours (OQ-A3).",
      "type": "array",
      "maxItems": 5000,
      "items": {
        "type": "object",
        "additionalProperties": false,
        "required": ["rule_id", "match_kind", "pattern", "category", "updated_at", "deleted"],
        "properties": {
          "rule_id": { "$ref": "#/$defs/uuid" },
          "match_kind": { "enum": ["app", "site", "title_contains"] },
          "pattern": {
            "description": "What to match. For title_contains this is text the user chose from their own window titles, so it can be sensitive: OQ-C2.",
            "x-open-question": "OQ-C2",
            "type": "string",
            "minLength": 1,
            "maxLength": 260
          },
          "category": { "enum": ["Study", "Work", "Entertainment", "Social Media", "Other"] },
          "updated_at": { "$ref": "#/$defs/utcTimestamp" },
          "deleted": { "type": "boolean" }
        }
      }
    },
    "deletion_requests": {
      "description": "Delete by date range or all (FR-28; 'one click, no dark patterns'). Each request is applied on the PC (raw events and local summaries) and in the cloud (summaries). Exact scope and acknowledgement are OQ-C6. Optional.",
      "x-open-question": "OQ-C6",
      "type": "array",
      "maxItems": 100,
      "items": {
        "type": "object",
        "additionalProperties": false,
        "required": ["request_id", "scope", "from", "to", "requested_at", "requested_by"],
        "properties": {
          "request_id": { "$ref": "#/$defs/uuid" },
          "scope": { "enum": ["all", "date_range"] },
          "from": { "type": ["string", "null"], "pattern": "^\\d{4}-\\d{2}-\\d{2}$" },
          "to": { "type": ["string", "null"], "pattern": "^\\d{4}-\\d{2}-\\d{2}$" },
          "requested_at": { "$ref": "#/$defs/utcTimestamp" },
          "requested_by": { "enum": ["agent", "dashboard"] }
        },
        "allOf": [
          {
            "if": { "properties": { "scope": { "const": "date_range" } } },
            "then": { "properties": { "from": { "type": "string" }, "to": { "type": "string" } } },
            "else": { "properties": { "from": { "type": "null" }, "to": { "type": "null" } } }
          }
        ]
      }
    },
    "account": {
      "description": "Written by the backend only; the agent never sends it and the backend ignores it from the agent. Lets the agent notice that the website terms changed (decision note website-activation.md). Optional.",
      "type": "object",
      "additionalProperties": false,
      "required": ["terms_version", "terms_accepted_at"],
      "properties": {
        "terms_version": { "type": "string", "minLength": 1, "maxLength": 32, "pattern": "^[A-Za-z0-9._-]+$" },
        "terms_accepted_at": { "$ref": "#/$defs/utcTimestamp" }
      }
    }
  },
  "$defs": {
    "uuid": { "type": "string", "pattern": "^[0-9a-f]{8}-[0-9a-f]{4}-[0-9a-f]{4}-[0-9a-f]{4}-[0-9a-f]{12}$" },
    "utcTimestamp": {
      "type": "string",
      "format": "date-time",
      "pattern": "^\\d{4}-\\d{2}-\\d{2}T\\d{2}:\\d{2}:\\d{2}(\\.\\d{1,3})?Z$"
    }
  }
}
